{
  "plan": "1",
  "project": "example-tool",
  "portfolio": "owner",
  "subjects": [
    {
      "name": "example-tool",
      "identifiers": [
        {
          "scheme": "npm",
          "value": "example-tool"
        },
        {
          "scheme": "github",
          "value": "example-org/example-tool"
        }
      ]
    }
  ],
  "sources": [
    {
      "adapter": "github-issues",
      "version": "1",
      "config": {
        "repository": "example-org/example-tool"
      },
      "from": "2025-01-01",
      "why": "Users of the tool asking for what it lacks.",
      "private": false
    },
    {
      "adapter": "local-files",
      "version": "1",
      "config": {
        "paths": [
          "notes/calls"
        ]
      },
      "from": "2026-01-01",
      "why": "The owner's call notes with customers.",
      "private": true,
      "consent": {
        "given_by": "the owner",
        "given_on": "2026-10-26",
        "scope": "the owner's own notes of customer calls",
        "evidence": "docs/consent/call-notes.md"
      },
      "lifetime_days": 365
    }
  ]
}
